{
  "slug": "ai-systems-engineering",
  "title": "AI Systems Engineering",
  "description": "Backend Engineer → AI/GenAI Backend Engineer → Agentic AI Engineer → AI Systems / Platform Engineer. 24 weeks, ~11 hrs/week.",
  "status": "active",
  "start_date": "2026-08-08",
  "target_date": "2027-01-23",
  "weekly_hours_target": 11,
  "sort_order": 1,
  "phases": [
    {
      "slug": "p1-llm-foundations",
      "title": "Phase 1 — LLM Foundations",
      "item_type": "study_plan",
      "sort_order": 1,
      "summary": "Decode loop, tokenization, context window, sampling, embeddings intro",
      "resources": [
        {
          "resource_type": "playlist",
          "title": "Krish Naik — YouTube channel",
          "url": "https://www.youtube.com/@krishnaik06",
          "priority": "supporting",
          "last_verified_at": "2026-08-08",
          "provider": "youtube",
          "author": "Krish Naik"
        },
        {
          "resource_type": "repo",
          "title": "Krish Naik — Roadmap To Learn Agentic AI",
          "url": "https://github.com/krishnaik06/Roadmap-To-Learn-Agentic-AI",
          "priority": "primary",
          "last_verified_at": "2026-08-08",
          "provider": "github",
          "author": "Krish Naik"
        },
        {
          "resource_type": "playlist",
          "title": "freeCodeCamp — YouTube channel",
          "url": "https://www.youtube.com/@freecodecamp",
          "priority": "supporting",
          "last_verified_at": "2026-08-08",
          "provider": "youtube",
          "author": "freeCodeCamp"
        },
        {
          "resource_type": "docs",
          "title": "DeepLearning.AI courses",
          "url": "https://www.deeplearning.ai/courses/",
          "priority": "primary",
          "last_verified_at": "2026-08-08",
          "provider": "deeplearning.ai"
        },
        {
          "resource_type": "docs",
          "title": "DeepLearning.AI short courses",
          "url": "https://www.deeplearning.ai/short-courses/",
          "priority": "primary",
          "last_verified_at": "2026-08-08",
          "provider": "deeplearning.ai"
        },
        {
          "resource_type": "article",
          "title": "DeepLearning.AI — The Batch",
          "url": "https://www.deeplearning.ai/the-batch/",
          "priority": "supporting",
          "last_verified_at": "2026-08-08",
          "provider": "deeplearning.ai"
        },
        {
          "resource_type": "playlist",
          "title": "Sheryians AI School",
          "url": "https://www.youtube.com/@sheryiansai",
          "priority": "optional",
          "last_verified_at": "2026-08-08",
          "provider": "youtube"
        },
        {
          "resource_type": "playlist",
          "title": "Krish Naik — Generative AI Tutorials",
          "url": "https://www.youtube.com/playlist?list=PLA1lVIthbM1D5I6r5uY2K89X1KD2w5LNh",
          "priority": "supporting",
          "last_verified_at": "2026-08-08",
          "provider": "youtube",
          "author": "Krish Naik"
        },
        {
          "resource_type": "docs",
          "title": "OpenAI — Text generation & prompting",
          "url": "https://platform.openai.com/docs/guides/text",
          "priority": "supporting",
          "last_verified_at": "2026-08-08",
          "provider": "openai"
        }
      ],
      "concepts": [
        {
          "slug": "autoregressive-decode-loop",
          "title": "The LLM as a stateless next-token function",
          "week_number": 1,
          "estimated_minutes": 90,
          "summary": "Depth: explain the loop (prompt in, one token out, append, repeat) and why prefill vs decode have different cost curves. Skip the maths.",
          "resources": [
            {
              "resource_type": "video",
              "title": "Karpathy — Intro to Large Language Models",
              "url": "https://www.youtube.com/watch?v=zjkBMFhNj_g",
              "priority": "primary",
              "last_verified_at": "2026-08-08",
              "provider": "youtube",
              "author": "Andrej Karpathy",
              "duration_minutes": 60,
              "sort_order": 1
            },
            {
              "resource_type": "video",
              "title": "3Blue1Brown — But what is a GPT?",
              "url": "https://www.youtube.com/watch?v=wjZofJX0v4M",
              "priority": "supporting",
              "last_verified_at": "2026-08-08",
              "provider": "youtube",
              "author": "3Blue1Brown",
              "sort_order": 2
            },
            {
              "resource_type": "video",
              "title": "Karpathy — Deep Dive into LLMs like ChatGPT",
              "url": "https://www.youtube.com/watch?v=7xTGNNLPyMI",
              "priority": "supporting",
              "last_verified_at": "2026-08-08",
              "provider": "youtube",
              "author": "Andrej Karpathy",
              "duration_minutes": 210,
              "sort_order": 3
            }
          ]
        },
        {
          "slug": "tokenization",
          "title": "Tokenization and the GPT tokenizer",
          "week_number": 1,
          "estimated_minutes": 75,
          "summary": "Depth: predict roughly how many tokens a payload costs and explain why non-English text and JSON inflate token counts.",
          "resources": [
            {
              "resource_type": "video",
              "title": "Karpathy — Let's build the GPT Tokenizer",
              "url": "https://www.youtube.com/watch?v=zduSFxRajkE",
              "priority": "primary",
              "last_verified_at": "2026-08-08",
              "provider": "youtube",
              "author": "Andrej Karpathy",
              "duration_minutes": 60,
              "sort_order": 1
            },
            {
              "resource_type": "docs",
              "title": "OpenAI Tokenizer (hands-on)",
              "url": "https://platform.openai.com/tokenizer",
              "priority": "supporting",
              "last_verified_at": "2026-08-08",
              "provider": "openai",
              "sort_order": 2
            },
            {
              "resource_type": "repo",
              "title": "tiktoken — BPE tokenizer used by OpenAI models",
              "url": "https://github.com/openai/tiktoken",
              "priority": "supporting",
              "last_verified_at": "2026-08-08",
              "provider": "github",
              "sort_order": 3
            }
          ]
        },
        {
          "slug": "attention-intuition",
          "title": "Attention intuition (skip the derivation)",
          "week_number": 1,
          "estimated_minutes": 60,
          "summary": "Depth: intuition for why cost grows with context length. Do NOT derive attention.",
          "resources": [
            {
              "resource_type": "video",
              "title": "3Blue1Brown — Attention in transformers",
              "url": "https://www.youtube.com/watch?v=eMlx5fFNoYc",
              "priority": "supporting",
              "last_verified_at": "2026-08-08",
              "provider": "youtube",
              "author": "3Blue1Brown",
              "sort_order": 1
            },
            {
              "resource_type": "article",
              "title": "Jay Alammar — The Illustrated Transformer",
              "url": "https://jalammar.github.io/illustrated-transformer/",
              "priority": "supporting",
              "last_verified_at": "2026-08-08",
              "author": "Jay Alammar",
              "sort_order": 2
            },
            {
              "resource_type": "video",
              "title": "Karpathy — Let's build GPT: from scratch, in code",
              "url": "https://www.youtube.com/watch?v=kCc8FmEb1nY",
              "priority": "supporting",
              "last_verified_at": "2026-08-08",
              "provider": "youtube",
              "author": "Andrej Karpathy",
              "duration_minutes": 116,
              "sort_order": 3
            }
          ]
        },
        {
          "slug": "context-window",
          "title": "Context window as a capacity-planning resource",
          "week_number": 1,
          "estimated_minutes": 45,
          "summary": "Depth: treat context as a capacity budget — know what happens at the limit (truncation vs error) and how to plan a token budget per request.",
          "resources": [
            {
              "resource_type": "docs",
              "title": "Anthropic — Context windows",
              "url": "https://docs.anthropic.com/en/docs/build-with-claude/context-windows",
              "priority": "primary",
              "last_verified_at": "2026-08-08",
              "provider": "anthropic",
              "sort_order": 1
            },
            {
              "resource_type": "docs",
              "title": "OpenAI — Text generation & prompting",
              "url": "https://platform.openai.com/docs/guides/text",
              "priority": "supporting",
              "last_verified_at": "2026-08-08",
              "provider": "openai",
              "sort_order": 2
            }
          ]
        },
        {
          "slug": "sampling",
          "title": "Sampling: temperature, top-p, and determinism trade-offs",
          "week_number": 1,
          "estimated_minutes": 45,
          "summary": "Depth: know when temperature 0 is required (extraction, tool args) vs helpful (drafting), and why 'temperature 0' is still not deterministic.",
          "resources": [
            {
              "resource_type": "docs",
              "title": "Hugging Face — Text generation strategies",
              "url": "https://huggingface.co/docs/transformers/generation_strategies",
              "priority": "primary",
              "last_verified_at": "2026-08-08",
              "provider": "huggingface",
              "sort_order": 1
            },
            {